VOS_ID,Authors,Title,Selected by,Year,Citations,Source,Cluster,Links,Total link strength,Norm. citations,id,doi,title,display_name,relevance_score,publication_year,publication_date,language,type,type_crossref,indexed_in,countries_distinct_count,institutions_distinct_count,corresponding_author_ids,corresponding_institution_ids,apc_list,apc_paid,fwci,has_fulltext,cited_by_count,is_retracted,is_paratext,locations_count,best_oa_location,datasets,versions,referenced_works_count,referenced_works,related_works,ngrams_url,cited_by_api_url,updated_date,created_date,ids.openalex,ids.doi,ids.mag,primary_location.is_oa,primary_location.landing_page_url,primary_location.pdf_url,primary_location.source.id,primary_location.source.display_name,primary_location.source.issn_l,primary_location.source.issn,primary_location.source.is_oa,primary_location.source.is_in_doaj,primary_location.source.is_core,primary_location.source.host_organization,primary_location.source.host_organization_name,primary_location.source.host_organization_lineage,primary_location.source.host_organization_lineage_names,primary_location.source.type,primary_location.license,primary_location.license_id,primary_location.version,primary_location.is_accepted,primary_location.is_published,open_access.is_oa,open_access.oa_status,open_access.oa_url,open_access.any_repository_has_fulltext,cited_by_percentile_year.min,cited_by_percentile_year.max,biblio.volume,biblio.issue,biblio.first_page,biblio.last_page,primary_topic.id,primary_topic.display_name,primary_topic.score,primary_topic.subfield.id,primary_topic.subfield.display_name,primary_topic.field.id,primary_topic.field.display_name,primary_topic.domain.id,primary_topic.domain.display_name,fulltext_origin,apc_list.value,apc_list.currency,apc_list.value_usd,apc_list.provenance,primary_location.source,apc_paid.value,apc_paid.currency,apc_paid.value_usd,apc_paid.provenance,best_oa_location.is_oa,best_oa_location.landing_page_url,best_oa_location.pdf_url,best_oa_location.source.id,best_oa_location.source.display_name,best_oa_location.source.issn_l,best_oa_location.source.issn,best_oa_location.source.is_oa,best_oa_location.source.is_in_doaj,best_oa_location.source.is_core,best_oa_location.source.host_organization,best_oa_location.source.host_organization_name,best_oa_location.source.host_organization_lineage,best_oa_location.source.host_organization_lineage_names,best_oa_location.source.type,best_oa_location.license,best_oa_location.license_id,best_oa_location.version,best_oa_location.is_accepted,best_oa_location.is_published,ids.pmid,ids.pmcid,best_oa_location.source,primary_topic,primary_location,abstract,authorships.author_position,authorships.institutions,authorships.countries,authorships.is_corresponding,authorships.raw_author_name,authorships.raw_affiliation_strings,authorships.affiliations,authorships.author.id,authorships.author.display_name,authorships.author.orcid,topics.id,topics.display_name,topics.score,topics.subfield.id,topics.subfield.display_name,topics.field.id,topics.field.display_name,topics.domain.id,topics.domain.display_name,keywords.id,keywords.display_name,keywords.score,concepts.id,concepts.wikidata,concepts.display_name,concepts.level,concepts.score,mesh.descriptor_ui,mesh.descriptor_name,mesh.qualifier_ui,mesh.qualifier_name,mesh.is_major_topic,locations.is_oa,locations.landing_page_url,locations.pdf_url,locations.license,locations.license_id,locations.version,locations.is_accepted,locations.is_published,locations.source.id,locations.source.display_name,locations.source.issn_l,locations.source.issn,locations.source.is_oa,locations.source.is_in_doaj,locations.source.is_core,locations.source.host_organization,locations.source.host_organization_name,locations.source.host_organization_lineage,locations.source.host_organization_lineage_names,locations.source.type,locations.source,sustainable_development_goals.id,sustainable_development_goals.display_name,sustainable_development_goals.score,grants.funder,grants.funder_display_name,grants.award_id,counts_by_year.year,counts_by_year.cited_by_count
2326,"['Kikelomo Oluwaseun Kila', ' Safiyya Ummu Mohammed']",Oil Pipelines Vandalism And Oil Theft: Security Threat To Nigerian Economy And Environment,Total link strength,2023,1.0,Journal of environmental law & policy,22,8.0,26.0,0.7743,https://openalex.org/W4367296881,https://doi.org/10.33002/jelp03.01.05,Oil Pipelines Vandalism and Oil Theft: Security Threat to Nigerian Economy and Environment,Oil Pipelines Vandalism And Oil Theft: Security Threat To Nigerian Economy And Environment,0.37151396,2023.0,2023-04-28,en,article,journal-article,crossref,0.0,0.0,,,,,0.221,True,1.0,False,False,1.0,,,,26.0,https://openalex.org/W1512801156|https://openalex.org/W2005660444|https://openalex.org/W2007026042|https://openalex.org/W2030575357|https://openalex.org/W2059195215|https://openalex.org/W2091961643|https://openalex.org/W2190364543|https://openalex.org/W2531564370|https://openalex.org/W2733259922|https://openalex.org/W2754893032|https://openalex.org/W2767934905|https://openalex.org/W2790370429|https://openalex.org/W2885641509|https://openalex.org/W2902429771|https://openalex.org/W2903119266|https://openalex.org/W2903360160|https://openalex.org/W2990337496|https://openalex.org/W2990794580|https://openalex.org/W3015773805|https://openalex.org/W3108665647|https://openalex.org/W3136817073|https://openalex.org/W3207657757|https://openalex.org/W3209629837|https://openalex.org/W4283390781|https://openalex.org/W4285114074|https://openalex.org/W4313329187,https://openalex.org/W47346751|https://openalex.org/W4367296881|https://openalex.org/W4312230475|https://openalex.org/W3192297372|https://openalex.org/W2506393635|https://openalex.org/W2368791997|https://openalex.org/W2133692904|https://openalex.org/W1964538998|https://openalex.org/W172330420|https://openalex.org/W1017425854,https://api.openalex.org/works/W4367296881/ngrams,https://api.openalex.org/works?filter=cites:W4367296881,2024-06-28T13:30:01.282615,2023-04-29,https://openalex.org/W4367296881,https://doi.org/10.33002/jelp03.01.05,,True,https://doi.org/10.33002/jelp03.01.05,https://grassrootsjournals.org/jelp/jelp0301-fullvolume.pdf,https://openalex.org/S4210221429,Journal of environmental law & policy,2564-016X,2564-016X,False,False,False,,,,,journal,cc-by,https://openalex.org/licenses/cc-by,publishedVersion,True,True,True,hybrid,https://grassrootsjournals.org/jelp/jelp0301-fullvolume.pdf,False,77.0,86.0,3.0,01,171,188,https://openalex.org/T14224,Global Impact of Gas Flaring,0.9813,https://openalex.org/subfields/2105,"Renewable Energy, Sustainability and the Environment",https://openalex.org/fields/21,Energy,https://openalex.org/domains/3,Physical Sciences,pdf,,,,,,,,,,True,https://doi.org/10.33002/jelp03.01.05,https://grassrootsjournals.org/jelp/jelp0301-fullvolume.pdf,https://openalex.org/S4210221429,Journal of environmental law & policy,2564-016X,2564-016X,False,False,False,,,,,journal,cc-by,https://openalex.org/licenses/cc-by,publishedVersion,True,True,,,,,,"Nigeria is a middle income country whose economy depends largely on crude and refined oil from its natural environment. A larger percentage of Nigeria economy survives mainly on the incomes from oil production. Over the years, there is recurrent dwindling oil revenue orchestrated by oil pipelines vandalism and oil theft in the environment. This is predominant in the Niger Delta Region of Nigeria. This menace has wreaked havoc on the Nigeria’s economy. Currently, the Nigerian National Petroleum Company Limited (NNPCL) claims the losses of 470,000 barrels per day of crude oil amounting to $700 million monthly due to oil theft. The disquiets of these menaces in the environment, which have posed serious threat to Nigeria’s economy, are addressed in this paper. This paper employed the doctrinal legal research methodology in evaluating the recurrent oil pipelines vandalism and oil theft causing a devastating economic meltdown. On this premise, this paper finds that persistent loss of barrels of crude oil and degradation of the environment are due to the lack of adequate security measures and proper enforcement of Oil Pipelines Act together with other relevant environmental laws. Based on the findings, this paper recommends a review of the Oil Pipelines Act, the establishment of a strong environmental security surveillance, and creation of a special court for accelerated prosecution of vandals. It concludes that this will mitigate the alarming economic meltdown of the Nigeria’s economy and promote a sustainable serene environment.",first|last,|,|,False|False,Awodezi Henry|Safiyya Ummu Mohammed,|,|,https://openalex.org/A5090902806|https://openalex.org/A5036661187,Kikelomo Oluwaseun Kila|Safiyya Ummu Mohammed,https://orcid.org/0000-0001-8998-7347|https://orcid.org/0009-0000-1892-8980,https://openalex.org/T14224|https://openalex.org/T12086|https://openalex.org/T11630,Global Impact of Gas Flaring|Modeling and Assessment of Pipeline Corrosion Damage|Petroleum Chemistry and Analysis,0.9813|0.9726|0.908,https://openalex.org/subfields/2105|https://openalex.org/subfields/2210|https://openalex.org/subfields/1602,"Renewable Energy, Sustainability and the Environment|Mechanical Engineering|Analytical Chemistry",https://openalex.org/fields/21|https://openalex.org/fields/22|https://openalex.org/fields/16,Energy|Engineering|Chemistry,https://openalex.org/domains/3|https://openalex.org/domains/3|https://openalex.org/domains/3,Physical Sciences|Physical Sciences|Physical Sciences,https://openalex.org/keywords/pipeline,Pipeline,0.466709,https://openalex.org/C175309249|https://openalex.org/C195487862|https://openalex.org/C526740375|https://openalex.org/C2779777834|https://openalex.org/C548895740|https://openalex.org/C198428699|https://openalex.org/C144133560|https://openalex.org/C2778843516|https://openalex.org/C2780262971|https://openalex.org/C136264566|https://openalex.org/C175605778|https://openalex.org/C127413603|https://openalex.org/C162324750|https://openalex.org/C199539241|https://openalex.org/C10138342|https://openalex.org/C17744445|https://openalex.org/C87717796|https://openalex.org/C151730666|https://openalex.org/C18903297|https://openalex.org/C139719470|https://openalex.org/C86803240,https://www.wikidata.org/wiki/Q725864|https://www.wikidata.org/wiki/Q850210|https://www.wikidata.org/wiki/Q862571|https://www.wikidata.org/wiki/Q4202277|https://www.wikidata.org/wiki/Q22656|https://www.wikidata.org/wiki/Q1334780|https://www.wikidata.org/wiki/Q4830453|https://www.wikidata.org/wiki/Q8250780|https://www.wikidata.org/wiki/Q44554|https://www.wikidata.org/wiki/Q159810|https://www.wikidata.org/wiki/Q3299701|https://www.wikidata.org/wiki/Q11023|https://www.wikidata.org/wiki/Q8134|https://www.wikidata.org/wiki/Q7748|https://www.wikidata.org/wiki/Q43015|https://www.wikidata.org/wiki/Q36442|https://www.wikidata.org/wiki/Q146326|https://www.wikidata.org/wiki/Q7205|https://www.wikidata.org/wiki/Q7150|https://www.wikidata.org/wiki/Q39680|https://www.wikidata.org/wiki/Q420,Pipeline transport|Revenue|Petroleum industry|Enforcement|Petroleum|Environmental degradation|Business|Oil boom|Law enforcement|Economy|Natural resource economics|Engineering|Economics|Law|Finance|Political science|Environmental engineering|Paleontology|Ecology|Macroeconomics|Biology,2|2|2|2|2|2|0|2|2|1|1|0|0|1|1|0|1|1|1|1|0,0.6239447|0.58448035|0.5801892|0.5298127|0.48842826|0.48020658|0.47218385|0.4634037|0.42852065|0.42002916|0.41461182|0.27216926|0.23983657|0.19409049|0.16799966|0.15979722|0.13254654|0.0|0.0|0.0|0.0,,,,,,True,https://doi.org/10.33002/jelp03.01.05,https://grassrootsjournals.org/jelp/jelp0301-fullvolume.pdf,cc-by,https://openalex.org/licenses/cc-by,publishedVersion,True,True,https://openalex.org/S4210221429,Journal of environmental law & policy,2564-016X,2564-016X,False,False,False,,,,,journal,,https://metadata.un.org/sdg/15,Life on land,0.45,,,,2024,1
3248,['Kikelomo Oluwaseun Kila'],Climate Change And Corporate Regulation In Angola: Reforming The Regulatory Framework For Climate Change Mitigation,Total link strength,2023,0.0,Journal of environmental law & policy,22,8.0,26.0,0.0,https://openalex.org/W4367307341,https://doi.org/10.33002/jelp03.01.04,Climate Change and Corporate Regulation in Angola: Reforming the Regulatory Framework for Climate Change Mitigation,Climate Change And Corporate Regulation In Angola: Reforming The Regulatory Framework For Climate Change Mitigation,0.09275612,2023.0,2023-04-28,en,article,journal-article,crossref,0.0,0.0,https://openalex.org/A5090902806,,,,,True,0.0,False,False,2.0,,,,26.0,https://openalex.org/W1512801156|https://openalex.org/W2005660444|https://openalex.org/W2007026042|https://openalex.org/W2030575357|https://openalex.org/W2059195215|https://openalex.org/W2091961643|https://openalex.org/W2190364543|https://openalex.org/W2531564370|https://openalex.org/W2733259922|https://openalex.org/W2754893032|https://openalex.org/W2767934905|https://openalex.org/W2790370429|https://openalex.org/W2885641509|https://openalex.org/W2902429771|https://openalex.org/W2903119266|https://openalex.org/W2903360160|https://openalex.org/W2990337496|https://openalex.org/W2990794580|https://openalex.org/W3015773805|https://openalex.org/W3108665647|https://openalex.org/W3136817073|https://openalex.org/W3207657757|https://openalex.org/W3209629837|https://openalex.org/W4283390781|https://openalex.org/W4285114074|https://openalex.org/W4313329187,https://openalex.org/W656836822|https://openalex.org/W4309661084|https://openalex.org/W4284992301|https://openalex.org/W4223432187|https://openalex.org/W3123799546|https://openalex.org/W2604827926|https://openalex.org/W2524759455|https://openalex.org/W2365964138|https://openalex.org/W2056749368|https://openalex.org/W1551842774,https://api.openalex.org/works/W4367307341/ngrams,https://api.openalex.org/works?filter=cites:W4367307341,2024-06-26T11:13:50.977316,2023-04-29,https://openalex.org/W4367307341,https://doi.org/10.33002/jelp03.01.04,,True,https://doi.org/10.33002/jelp03.01.04,https://grassrootsjournals.org/jelp/jelp0301-fullvolume.pdf,https://openalex.org/S4210221429,Journal of environmental law & policy,2564-016X,2564-016X,False,False,False,,,,,journal,cc-by,https://openalex.org/licenses/cc-by,publishedVersion,True,True,True,hybrid,https://grassrootsjournals.org/jelp/jelp0301-fullvolume.pdf,True,0.0,77.0,3.0,01,132,170,https://openalex.org/T13146,Impact of Green Bonds on Climate Finance,0.7882,https://openalex.org/subfields/2003,Finance,https://openalex.org/fields/20,"Economics, Econometrics and Finance",https://openalex.org/domains/2,Social Sciences,pdf,,,,,,,,,,True,https://doi.org/10.33002/jelp03.01.04,https://grassrootsjournals.org/jelp/jelp0301-fullvolume.pdf,https://openalex.org/S4210221429,Journal of environmental law & policy,2564-016X,2564-016X,False,False,False,,,,,journal,cc-by,https://openalex.org/licenses/cc-by,publishedVersion,True,True,,,,,,"Angola, like many African countries, continuously suffers the deleterious impacts of climate change despite its minimal global carbon contributions. Despite this, it has not taken active steps to institute a climate change regulatory framework or established any strong regulatory regime to aid the regulation of corporate activities and participation in mitigation projects in the country. This article examines the regulatory landscape of climate change and corporations in Angola and assesses the country’s ability to tackle the challenges posed by climate change. It examines the country's position in the international climate change arena and scrutinizes the contribution of corporations to Angola's carbon emissions. The absence of legislation on climate change in Angola creates a void which allows corporations in the country to avoid any responsibility for mitigation projects and activities. This article, therefore, analyses the strengths and weaknesses of the alternative regulatory frameworks such as judicial, market, and surrogate regulation that can operate to fill this void and the extent to which they curtail corporate excesses in climate change and incentivise participation in mitigation activities. In scrutinising the deficiencies of Angola’s climate change regulatory framework, the article adopts the dilute interventionism model which employs both prescriptive and facilitative measures to regulate corporations and mitigate the impact of climate change. It highlights the structure of the legislative framework, regulator, and technical expertise necessary for the successful implementation of the said model. Additionally, the article argues in favour of adopting a veto firewall protection to maintain the independence of the proposed sole independent regulator to be responsible for regulating the climate change activities of corporations in Angola.",first,,,True,Kikelomo Oluwaseun Kila,,,https://openalex.org/A5090902806,Kikelomo Oluwaseun Kila,https://orcid.org/0000-0001-8998-7347,https://openalex.org/T13146|https://openalex.org/T11939|https://openalex.org/T12895,Impact of Green Bonds on Climate Finance|Public-Private Partnerships in Infrastructure Development|Legal Recognition of Nature's Rights and Environmental Governance,0.7882|0.691|0.6726,https://openalex.org/subfields/2003|https://openalex.org/subfields/1408|https://openalex.org/subfields/3308,Finance|Strategy and Management|Law,https://openalex.org/fields/20|https://openalex.org/fields/14|https://openalex.org/fields/33,"Economics, Econometrics and Finance|Business, Management and Accounting|Social Sciences",https://openalex.org/domains/2|https://openalex.org/domains/2|https://openalex.org/domains/2,Social Sciences|Social Sciences|Social Sciences,https://openalex.org/keywords/climate-finance,Climate Finance,0.454766,https://openalex.org/C132651083|https://openalex.org/C509746633|https://openalex.org/C83009810|https://openalex.org/C144133560|https://openalex.org/C189123395|https://openalex.org/C2777351106|https://openalex.org/C107826830|https://openalex.org/C17744445|https://openalex.org/C162324750|https://openalex.org/C175605778|https://openalex.org/C18903297|https://openalex.org/C199539241|https://openalex.org/C86803240,https://www.wikidata.org/wiki/Q7942|https://www.wikidata.org/wiki/Q898653|https://www.wikidata.org/wiki/Q11204|https://www.wikidata.org/wiki/Q4830453|https://www.wikidata.org/wiki/Q7210295|https://www.wikidata.org/wiki/Q49371|https://www.wikidata.org/wiki/Q929380|https://www.wikidata.org/wiki/Q36442|https://www.wikidata.org/wiki/Q8134|https://www.wikidata.org/wiki/Q3299701|https://www.wikidata.org/wiki/Q7150|https://www.wikidata.org/wiki/Q7748|https://www.wikidata.org/wiki/Q420,Climate change|Climate change mitigation|Legislature|Business|Political economy of climate change|Legislation|Environmental resource management|Political science|Economics|Natural resource economics|Ecology|Law|Biology,2|3|2|0|3|2|1|0|0|1|1|1|0,0.7261033|0.6231641|0.5703559|0.51208425|0.5091838|0.49817634|0.3770334|0.3672725|0.3508194|0.34314394|0.12793988|0.08737177|0.0,,,,,,True|True,https://doi.org/10.33002/jelp03.01.04|https://grassrootsjournals.org/jelp/jelp0301-fullvolume.pdf#page=142,https://grassrootsjournals.org/jelp/jelp0301-fullvolume.pdf|https://grassrootsjournals.org/jelp/jelp0301-fullvolume.pdf#page=142,cc-by|cc-by,https://openalex.org/licenses/cc-by|https://openalex.org/licenses/cc-by,publishedVersion|publishedVersion,True|True,True|True,https://openalex.org/S4210221429|https://openalex.org/S4306402508,Journal of environmental law & policy|Huddersfield Research Portal (University of Huddersfield),2564-016X|None,2564-016X|None,False|True,False|False,False|False,None|https://openalex.org/I133837150,None|University of Huddersfield,|https://openalex.org/I133837150,|University of Huddersfield,journal|repository,nan|nan,https://metadata.un.org/sdg/13,Climate action,0.64,,,,,
